icon,title,org,prize,deadline,theme,prep,template,winners,desc,link,meta
⚡,Anthropic AI Safety Hackathon,Anthropic,~$50K (varies by event),Check official site for next dates,"Safety, interpretability, alignment",Complete P2 Prompting + P16 Security modules first,Guardrailed agent + eval harness + short policy doc,Winning teams often combine strong eval metrics with crisp demos (Streamlit/FastAPI).,Build systems with safety or interpretability focus; mentor access from lab engineers.,https://www.anthropic.com/,"'🟢 Recurring', '💰 Prizes', '🌍 Online'"
🤗,Hugging Face Open-Source Sprint,HuggingFace,Hub credits + visibility,Quarterly sprints,"Models, datasets, Spaces",P1 foundations + P6 frameworks + P7 RAG,Gradio Space + dataset card + small model or adapter,"Top entries ship clean cards, reproducible training, and eval tables.",48-hour style sprints for Hub-ready artifacts.,https://huggingface.co/,"'🟢 Quarterly', '🆓 Free entry', '🌍 Global'"
🏆,Devpost AI Hackathons,Devpost,$10K–$100K depending on sponsor,Rolling calendar,"Sponsor-specific (Gemini, AWS, Azure, …)",P3 LLM APIs + P14 deployment,MVP API + minimal UI + 90-second demo video,Clear problem statement + live demo + public repo fork win most tracks.,Filter by AI; many enterprise-sponsored challenges.,https://devpost.com/hackathons?themes=ai,"'🟢 Ongoing', '💰 Variable', '🌍 Global'"
🔵,LangGraph Build Challenge,LangChain,Credits + ecosystem visibility,Periodic announcements,Production agents,P4 Agents + P6 LangGraph depth,StateGraph + tool routing + LangSmith traces,"Projects with traces, tests, and Dockerfile score highest.","Focus on durable, deployable LangGraph apps.",https://python.langchain.com/,"'🟡 Periodic', '💰 Credits', '🌍 Global'"
🌐,Google AI Hackathon (Gemini),Google,Large pooled prizes (see site),Annual / regional,Gemini API apps,P3 multimodal + P14 FastAPI/Streamlit,Gemini tool use + OAuth + hosted demo,Creative multimodal UX with latency under control.,Build on Gemini with mentor office hours.,https://ai.google.dev/,"'🟢 Major events', '💰 High pool', '🌍 Global'"
🤖,CrewAI Multi-Agent Challenge,CrewAI,Cash + enterprise intros,Periodic,Multi-agent crews,P4 collaboration + P6 CrewAI module,Defined roles + sequential process + task outputs,Clear agent boundaries and measurable task success.,Enterprise-flavored multi-agent builds.,https://www.crewai.com/,"'🟡 Periodic', '💰 Mixed', '🌍 Global'"
💡,n8n Automation Hackathon,n8n,~$5K (see rules),Quarterly,Workflow + AI nodes,P13 automation modules,Webhook → LLM → CRM/Slack with error branch,Reusable templates published to marketplace trend well.,AI-powered automations in n8n.,https://n8n.io/,"'🟢 Quarterly', '💰 Prizes', '🌍 Global'"
